run_at,company_name,category,status,titles,new_titles,check_url,http_status,error
2026-07-14T02:54:22+06:00,BD Govt Investment Sukuk (BGIS),NBFI,JOB FOUND,"Executives | Treasury Bill/Bond auctions | Data Of Treasury Bills & Bonds | Credit Rating Of Banks | Primary Auction of Treasury Bill & Bond | Secondary Trading of Treasury Bills and Bonds | G-Sec Investment Process | BD Govt Investment Sukuk (BGIS) | Publication Weekly Fortnightly Monthly Quarterly Half Yearly Annual Research Work Special Publication Others | Draft Investment products: Bai-Murabaha - policy [Please send your feedback/coments/suggestions to masiur.rahman@bb.org.bd within 03 August, 2026] | BRPD-3 Circular Letter No. 01: Pre Finance Scheme to Support the Closed Industry and Service Sectors | INVESTMENT FACILITY | Foreign Investment and Financing Portal | SAARCFINANCE | BBTA Journal: Thoughts on Banking and Finance","Executives | Treasury Bill/Bond auctions | Data Of Treasury Bills & Bonds | Credit Rating Of Banks | Primary Auction of Treasury Bill & Bond | Secondary Trading of Treasury Bills and Bonds | G-Sec Investment Process | BD Govt Investment Sukuk (BGIS) | Publication Weekly Fortnightly Monthly Quarterly Half Yearly Annual Research Work Special Publication Others | Draft Investment products: Bai-Murabaha - policy [Please send your feedback/coments/suggestions to masiur.rahman@bb.org.bd within 03 August, 2026] | BRPD-3 Circular Letter No. 01: Pre Finance Scheme to Support the Closed Industry and Service Sectors | INVESTMENT FACILITY | Foreign Investment and Financing Portal | SAARCFINANCE | BBTA Journal: Thoughts on Banking and Finance",https://www.bb.org.bd/en/index.php,200,
2026-07-14T02:54:22+06:00,Central Banks,NBFI,JOB FOUND,"Economics, policy analysis and research | Banking and risk management | Legal and internal audit | Legal information","Economics, policy analysis and research | Banking and risk management | Legal and internal audit | Legal information",https://www.bis.org/careers/index.htm,200,
2026-07-14T02:54:22+06:00,Credit Rating Agency,NBFI,JOB FOUND,"Executives | Treasury Bill/Bond auctions | Data Of Treasury Bills & Bonds | Credit Rating Of Banks | Primary Auction of Treasury Bill & Bond | Secondary Trading of Treasury Bills and Bonds | G-Sec Investment Process | BD Govt Investment Sukuk (BGIS) | Publication Weekly Fortnightly Monthly Quarterly Half Yearly Annual Research Work Special Publication Others | Draft Investment products: Bai-Murabaha - policy [Please send your feedback/coments/suggestions to masiur.rahman@bb.org.bd within 03 August, 2026] | BRPD-3 Circular Letter No. 01: Pre Finance Scheme to Support the Closed Industry and Service Sectors | INVESTMENT FACILITY | Foreign Investment and Financing Portal | SAARCFINANCE | BBTA Journal: Thoughts on Banking and Finance","Executives | Treasury Bill/Bond auctions | Data Of Treasury Bills & Bonds | Credit Rating Of Banks | Primary Auction of Treasury Bill & Bond | Secondary Trading of Treasury Bills and Bonds | G-Sec Investment Process | BD Govt Investment Sukuk (BGIS) | Publication Weekly Fortnightly Monthly Quarterly Half Yearly Annual Research Work Special Publication Others | Draft Investment products: Bai-Murabaha - policy [Please send your feedback/coments/suggestions to masiur.rahman@bb.org.bd within 03 August, 2026] | BRPD-3 Circular Letter No. 01: Pre Finance Scheme to Support the Closed Industry and Service Sectors | INVESTMENT FACILITY | Foreign Investment and Financing Portal | SAARCFINANCE | BBTA Journal: Thoughts on Banking and Finance",https://www.bb.org.bd/en/index.php,200,
2026-07-14T02:54:22+06:00,Credit Rating Of Banks,NBFI,JOB FOUND,"Executives | Treasury Bill/Bond auctions | Data Of Treasury Bills & Bonds | Credit Rating Of Banks | Primary Auction of Treasury Bill & Bond | Secondary Trading of Treasury Bills and Bonds | G-Sec Investment Process | BD Govt Investment Sukuk (BGIS) | Publication Weekly Fortnightly Monthly Quarterly Half Yearly Annual Research Work Special Publication Others | Draft Investment products: Bai-Murabaha - policy [Please send your feedback/coments/suggestions to masiur.rahman@bb.org.bd within 03 August, 2026] | BRPD-3 Circular Letter No. 01: Pre Finance Scheme to Support the Closed Industry and Service Sectors | INVESTMENT FACILITY | Foreign Investment and Financing Portal | SAARCFINANCE | BBTA Journal: Thoughts on Banking and Finance","Executives | Treasury Bill/Bond auctions | Data Of Treasury Bills & Bonds | Credit Rating Of Banks | Primary Auction of Treasury Bill & Bond | Secondary Trading of Treasury Bills and Bonds | G-Sec Investment Process | BD Govt Investment Sukuk (BGIS) | Publication Weekly Fortnightly Monthly Quarterly Half Yearly Annual Research Work Special Publication Others | Draft Investment products: Bai-Murabaha - policy [Please send your feedback/coments/suggestions to masiur.rahman@bb.org.bd within 03 August, 2026] | BRPD-3 Circular Letter No. 01: Pre Finance Scheme to Support the Closed Industry and Service Sectors | INVESTMENT FACILITY | Foreign Investment and Financing Portal | SAARCFINANCE | BBTA Journal: Thoughts on Banking and Finance",https://www.bb.org.bd/en/index.php,200,
2026-07-14T02:54:22+06:00,CVC Finance PLC.,NBFI,BLOCKED,,,http://www.cvcflbd.com,,Blocked by robots.txt: http://www.cvcflbd.com/robots.txt
2026-07-14T02:54:22+06:00,FAQ on Government Securities Market,NBFI,JOB FOUND,"Executives | Treasury Bill/Bond auctions | Data Of Treasury Bills & Bonds | Credit Rating Of Banks | Primary Auction of Treasury Bill & Bond | Secondary Trading of Treasury Bills and Bonds | G-Sec Investment Process | BD Govt Investment Sukuk (BGIS) | Publication Weekly Fortnightly Monthly Quarterly Half Yearly Annual Research Work Special Publication Others | Draft Investment products: Bai-Murabaha - policy [Please send your feedback/coments/suggestions to masiur.rahman@bb.org.bd within 03 August, 2026] | BRPD-3 Circular Letter No. 01: Pre Finance Scheme to Support the Closed Industry and Service Sectors | INVESTMENT FACILITY | Foreign Investment and Financing Portal | SAARCFINANCE | BBTA Journal: Thoughts on Banking and Finance","Executives | Treasury Bill/Bond auctions | Data Of Treasury Bills & Bonds | Credit Rating Of Banks | Primary Auction of Treasury Bill & Bond | Secondary Trading of Treasury Bills and Bonds | G-Sec Investment Process | BD Govt Investment Sukuk (BGIS) | Publication Weekly Fortnightly Monthly Quarterly Half Yearly Annual Research Work Special Publication Others | Draft Investment products: Bai-Murabaha - policy [Please send your feedback/coments/suggestions to masiur.rahman@bb.org.bd within 03 August, 2026] | BRPD-3 Circular Letter No. 01: Pre Finance Scheme to Support the Closed Industry and Service Sectors | INVESTMENT FACILITY | Foreign Investment and Financing Portal | SAARCFINANCE | BBTA Journal: Thoughts on Banking and Finance",https://www.bb.org.bd/en/index.php,200,
2026-07-14T02:54:22+06:00,Fareast Finance & Investment Limited,NBFI,BLOCKED,,,http://www.ffilbd.com,,Blocked by robots.txt: http://www.ffilbd.com/robots.txt
2026-07-14T02:54:22+06:00,FAS Finance & Investment Limited,NBFI,JOB FOUND,"Executive Committee | Corporate Finance Lease/Sale & Lease Back Term Loan Financing Project Financing Short Term Loan (revolving) Specialized Products | Structured Finance Fund Raising Advisory Services Securitization of Assets | SME Finance | Retail Finance Home Loan Auto Loan Personal Loan Loan against TDR | Treasury Operations Call Money replacement Treasury Line Finance | Capital Market Portfolio Management Margin Loan Facility Issue Management Underwriting Corporate Advisory Fees & Charges | Statement Of Compliance | Credit Rating Credit Rating | Premier Finance Institution in the country. | Open and informal culture where we value integrity, commitment, teamwork and excellence in customer service.","Executive Committee | Corporate Finance Lease/Sale & Lease Back Term Loan Financing Project Financing Short Term Loan (revolving) Specialized Products | Structured Finance Fund Raising Advisory Services Securitization of Assets | SME Finance | Retail Finance Home Loan Auto Loan Personal Loan Loan against TDR | Treasury Operations Call Money replacement Treasury Line Finance | Capital Market Portfolio Management Margin Loan Facility Issue Management Underwriting Corporate Advisory Fees & Charges | Statement Of Compliance | Credit Rating Credit Rating | Premier Finance Institution in the country. | Open and informal culture where we value integrity, commitment, teamwork and excellence in customer service.",https://www.fasbd.com/career.html,200,
2026-07-14T02:54:22+06:00,Finance Companies,NBFI,JOB FOUND,"Executives | Treasury Bill/Bond auctions | Data Of Treasury Bills & Bonds | Credit Rating Of Banks | Primary Auction of Treasury Bill & Bond | Secondary Trading of Treasury Bills and Bonds | G-Sec Investment Process | BD Govt Investment Sukuk (BGIS) | Publication Weekly Fortnightly Monthly Quarterly Half Yearly Annual Research Work Special Publication Others | Draft Investment products: Bai-Murabaha - policy [Please send your feedback/coments/suggestions to masiur.rahman@bb.org.bd within 03 August, 2026] | BRPD-3 Circular Letter No. 01: Pre Finance Scheme to Support the Closed Industry and Service Sectors | INVESTMENT FACILITY | Foreign Investment and Financing Portal | SAARCFINANCE | BBTA Journal: Thoughts on Banking and Finance","Executives | Treasury Bill/Bond auctions | Data Of Treasury Bills & Bonds | Credit Rating Of Banks | Primary Auction of Treasury Bill & Bond | Secondary Trading of Treasury Bills and Bonds | G-Sec Investment Process | BD Govt Investment Sukuk (BGIS) | Publication Weekly Fortnightly Monthly Quarterly Half Yearly Annual Research Work Special Publication Others | Draft Investment products: Bai-Murabaha - policy [Please send your feedback/coments/suggestions to masiur.rahman@bb.org.bd within 03 August, 2026] | BRPD-3 Circular Letter No. 01: Pre Finance Scheme to Support the Closed Industry and Service Sectors | INVESTMENT FACILITY | Foreign Investment and Financing Portal | SAARCFINANCE | BBTA Journal: Thoughts on Banking and Finance",https://www.bb.org.bd/en/index.php,200,
2026-07-14T02:54:22+06:00,First Finance Limited,NBFI,JOB FOUND,Executive Committee | Risk Management Committee | Lease Finance & Sales Lease Back | Working Capital Finance | B.Bank Refinance Scheme | Credit Rating | BSEC CGG Compliance Status | Lease Finance & Sale Lease Back | SME Under Bangladesh Bank Refinance Scheme | Head Office FLW Committee | Head of Internal Control & Compliance Department(ICCD) Phone : +8801987007800 E-mail: ripan.chandra@first-finance.com.bd,Executive Committee | Risk Management Committee | Lease Finance & Sales Lease Back | Working Capital Finance | B.Bank Refinance Scheme | Credit Rating | BSEC CGG Compliance Status | Lease Finance & Sale Lease Back | SME Under Bangladesh Bank Refinance Scheme | Head Office FLW Committee | Head of Internal Control & Compliance Department(ICCD) Phone : +8801987007800 E-mail: ripan.chandra@first-finance.com.bd,https://www.first-finance.com.bd/career/,200,
2026-07-14T02:54:22+06:00,Foreign Investment and Financing Portal,NBFI,CHECK FAILED,,,https://www.bb.org.bd/en/index.php/links/feidportal/index.php,404,HTTP 404
2026-07-14T02:54:22+06:00,G-Sec Investment Process,NBFI,JOB FOUND,"Executives | Treasury Bill/Bond auctions | Data Of Treasury Bills & Bonds | Credit Rating Of Banks | Primary Auction of Treasury Bill & Bond | Secondary Trading of Treasury Bills and Bonds | G-Sec Investment Process | BD Govt Investment Sukuk (BGIS) | Publication Weekly Fortnightly Monthly Quarterly Half Yearly Annual Research Work Special Publication Others | Draft Investment products: Bai-Murabaha - policy [Please send your feedback/coments/suggestions to masiur.rahman@bb.org.bd within 03 August, 2026] | BRPD-3 Circular Letter No. 01: Pre Finance Scheme to Support the Closed Industry and Service Sectors | INVESTMENT FACILITY | Foreign Investment and Financing Portal | SAARCFINANCE | BBTA Journal: Thoughts on Banking and Finance","Executives | Treasury Bill/Bond auctions | Data Of Treasury Bills & Bonds | Credit Rating Of Banks | Primary Auction of Treasury Bill & Bond | Secondary Trading of Treasury Bills and Bonds | G-Sec Investment Process | BD Govt Investment Sukuk (BGIS) | Publication Weekly Fortnightly Monthly Quarterly Half Yearly Annual Research Work Special Publication Others | Draft Investment products: Bai-Murabaha - policy [Please send your feedback/coments/suggestions to masiur.rahman@bb.org.bd within 03 August, 2026] | BRPD-3 Circular Letter No. 01: Pre Finance Scheme to Support the Closed Industry and Service Sectors | INVESTMENT FACILITY | Foreign Investment and Financing Portal | SAARCFINANCE | BBTA Journal: Thoughts on Banking and Finance",https://www.bb.org.bd/en/index.php,200,
2026-07-14T02:54:22+06:00,Government Securities Market,NBFI,JOB FOUND,"Executives | Treasury Bill/Bond auctions | Data Of Treasury Bills & Bonds | Credit Rating Of Banks | Primary Auction of Treasury Bill & Bond | Secondary Trading of Treasury Bills and Bonds | G-Sec Investment Process | BD Govt Investment Sukuk (BGIS) | Publication Weekly Fortnightly Monthly Quarterly Half Yearly Annual Research Work Special Publication Others | Draft Investment products: Bai-Murabaha - policy [Please send your feedback/coments/suggestions to masiur.rahman@bb.org.bd within 03 August, 2026] | BRPD-3 Circular Letter No. 01: Pre Finance Scheme to Support the Closed Industry and Service Sectors | INVESTMENT FACILITY | Foreign Investment and Financing Portal | SAARCFINANCE | BBTA Journal: Thoughts on Banking and Finance","Executives | Treasury Bill/Bond auctions | Data Of Treasury Bills & Bonds | Credit Rating Of Banks | Primary Auction of Treasury Bill & Bond | Secondary Trading of Treasury Bills and Bonds | G-Sec Investment Process | BD Govt Investment Sukuk (BGIS) | Publication Weekly Fortnightly Monthly Quarterly Half Yearly Annual Research Work Special Publication Others | Draft Investment products: Bai-Murabaha - policy [Please send your feedback/coments/suggestions to masiur.rahman@bb.org.bd within 03 August, 2026] | BRPD-3 Circular Letter No. 01: Pre Finance Scheme to Support the Closed Industry and Service Sectors | INVESTMENT FACILITY | Foreign Investment and Financing Portal | SAARCFINANCE | BBTA Journal: Thoughts on Banking and Finance",https://www.bb.org.bd/en/index.php,200,
2026-07-14T02:54:22+06:00,GSP Finance Company (Bangladesh) Limited (GSPB),NBFI,JOB FOUND,Executive Committee | Loan and Lease Lease Finance Term Lending Syndicate Finance Secured Loan SME Finance Women Entrepreneurs Loan Bridge/Equity Finance | Merchant Banking Corporate Information Service Portfolio Management Issue Management Underwriting of Public Issue Investment Advisory Services | Compliance Report On Corporate Governance Code By BSEC | Dividend Distribution Compliance Report | Credit Rating | Contact Us Address Complaint Cell Information Officer | Term Loans and Bridge Finance | Share Investment Service,Executive Committee | Loan and Lease Lease Finance Term Lending Syndicate Finance Secured Loan SME Finance Women Entrepreneurs Loan Bridge/Equity Finance | Merchant Banking Corporate Information Service Portfolio Management Issue Management Underwriting of Public Issue Investment Advisory Services | Compliance Report On Corporate Governance Code By BSEC | Dividend Distribution Compliance Report | Credit Rating | Contact Us Address Complaint Cell Information Officer | Term Loans and Bridge Finance | Share Investment Service,https://www.gspfinance.com/careers,200,
2026-07-14T02:54:22+06:00,Hajj Finance Company Limited,NBFI,CHECK FAILED,,,http://www.hajjfinance.net,,"ConnectionError: ('Connection aborted.', ConnectionResetError(104, 'Connection reset by peer'))"
2026-07-14T02:54:22+06:00,http://phoenixfinance.com.bd,NBFI,JOB FOUND,About Us Phoenix at a Glance Mission & Vision Directors Management Head of Branches | Products & Services Finance Products Deposit Products | Join Our Team at Phoenix Finance | 1. Relationship Executive | career.phoenixfinance@gmail.com | mail@phoenixfinance.com.bd,About Us Phoenix at a Glance Mission & Vision Directors Management Head of Branches | Products & Services Finance Products Deposit Products | Join Our Team at Phoenix Finance | 1. Relationship Executive | career.phoenixfinance@gmail.com | mail@phoenixfinance.com.bd,http://phoenixfinance.com.bd/career,200,
2026-07-14T02:54:22+06:00,http://www.bd.finance,NBFI,CHECK FAILED,,,http://www.bd.finance,,"ConnectionError: HTTPConnectionPool(host='www.bd.finance', port=80): Max retries exceeded with url: / (Caused by NameResolutionError(""HTTPConnection(host='www.bd.finance', port=80): Failed to resolve 'www.bd.finance' ([Errno -2] Name or service not known)""))"
2026-07-14T02:54:22+06:00,http://www.first-finance.com.bd,NBFI,JOB FOUND,Executive Committee | Risk Management Committee | Lease Finance & Sales Lease Back | Working Capital Finance | B.Bank Refinance Scheme | Credit Rating | BSEC CGG Compliance Status | Lease Finance & Sale Lease Back | SME Under Bangladesh Bank Refinance Scheme | Head Office FLW Committee | Head of Internal Control & Compliance Department(ICCD) Phone : +8801987007800 E-mail: ripan.chandra@first-finance.com.bd,Executive Committee | Risk Management Committee | Lease Finance & Sales Lease Back | Working Capital Finance | B.Bank Refinance Scheme | Credit Rating | BSEC CGG Compliance Status | Lease Finance & Sale Lease Back | SME Under Bangladesh Bank Refinance Scheme | Head Office FLW Committee | Head of Internal Control & Compliance Department(ICCD) Phone : +8801987007800 E-mail: ripan.chandra@first-finance.com.bd,https://www.first-finance.com.bd/career/,200,
2026-07-14T02:54:22+06:00,http://www.gspfinance.com,NBFI,JOB FOUND,Executive Committee | Loan and Lease Lease Finance Term Lending Syndicate Finance Secured Loan SME Finance Women Entrepreneurs Loan Bridge/Equity Finance | Merchant Banking Corporate Information Service Portfolio Management Issue Management Underwriting of Public Issue Investment Advisory Services | Compliance Report On Corporate Governance Code By BSEC | Dividend Distribution Compliance Report | Credit Rating | Contact Us Address Complaint Cell Information Officer | Term Loans and Bridge Finance | Share Investment Service,Executive Committee | Loan and Lease Lease Finance Term Lending Syndicate Finance Secured Loan SME Finance Women Entrepreneurs Loan Bridge/Equity Finance | Merchant Banking Corporate Information Service Portfolio Management Issue Management Underwriting of Public Issue Investment Advisory Services | Compliance Report On Corporate Governance Code By BSEC | Dividend Distribution Compliance Report | Credit Rating | Contact Us Address Complaint Cell Information Officer | Term Loans and Bridge Finance | Share Investment Service,https://www.gspfinance.com/careers,200,
2026-07-14T02:54:22+06:00,http://www.hajjfinance.net,NBFI,CHECK FAILED,,,http://www.hajjfinance.net,,"ConnectionError: ('Connection aborted.', ConnectionResetError(104, 'Connection reset by peer'))"
2026-07-14T02:54:22+06:00,http://www.meridianfinancebd.com,NBFI,JOB FOUND,CLUSTER FINANCE POLICY | Islamic Finance Shariar Supervisory Committee Deposit Products Investment Products Forms & Documents | Investor Relations Annual Report Credit Rating Financial Highlights Financial Statements Shareholding Structure | Email : info@meridianfinancebd.com | Our Leadership Team Board of Directors Executive Committee Audit Committee Management Team,CLUSTER FINANCE POLICY | Islamic Finance Shariar Supervisory Committee Deposit Products Investment Products Forms & Documents | Investor Relations Annual Report Credit Rating Financial Highlights Financial Statements Shareholding Structure | Email : info@meridianfinancebd.com | Our Leadership Team Board of Directors Executive Committee Audit Committee Management Team,https://www.meridianfinancebd.com/career,200,
2026-07-14T02:54:22+06:00,http://www.primefinancebd.com,NBFI,JOB FOUND,Subsidiary & Associates | BSEC CGG Compliance Status | Compliance Certificate on Corporate Governance,Subsidiary & Associates | BSEC CGG Compliance Status | Compliance Certificate on Corporate Governance,http://www.primefinancebd.com/,200,
2026-07-14T02:54:22+06:00,http://www.uttarafinance.biz,NBFI,JOB FOUND,webmaster@uttarafinance.biz,webmaster@uttarafinance.biz,http://www.uttarafinance.biz/cgi-sys/defaultwebpage.cgi,200,
2026-07-14T02:54:22+06:00,IIDFC PLC.,NBFI,JOB FOUND,Executive Committee | Risk Management Committee | Investor Relation Annual Reports Discloser Under CAMD Monthly Base Rate Credit Rating | PRODUCTS & SERVICES Corporate Finance SME Finance Structured Finance Retail Finance Refinance Scheme | SUSTAINABLE FINANCE CDM Project Development Energy Efficiency Financing Green Finance Project Quarterly Report Policies & Guideline | HR Principles | HEAD OFFICE,Executive Committee | Risk Management Committee | Investor Relation Annual Reports Discloser Under CAMD Monthly Base Rate Credit Rating | PRODUCTS & SERVICES Corporate Finance SME Finance Structured Finance Retail Finance Refinance Scheme | SUSTAINABLE FINANCE CDM Project Development Energy Efficiency Financing Green Finance Project Quarterly Report Policies & Guideline | HR Principles | HEAD OFFICE,https://www.iidfc.com/others/career,200,
2026-07-14T02:54:22+06:00,Infrastructure Development Company Limited (IDCOL),NBFI,JOB FOUND,Career Work Environment Job Vacancies Internship Login,Career Work Environment Job Vacancies Internship Login,https://idcol.org/home/vacancies,200,
2026-07-14T02:54:22+06:00,Inter Bank Money Market,NBFI,JOB FOUND,"Executives | Treasury Bill/Bond auctions | Data Of Treasury Bills & Bonds | Credit Rating Of Banks | Primary Auction of Treasury Bill & Bond | Secondary Trading of Treasury Bills and Bonds | G-Sec Investment Process | BD Govt Investment Sukuk (BGIS) | Publication Weekly Fortnightly Monthly Quarterly Half Yearly Annual Research Work Special Publication Others | Draft Investment products: Bai-Murabaha - policy [Please send your feedback/coments/suggestions to masiur.rahman@bb.org.bd within 03 August, 2026] | BRPD-3 Circular Letter No. 01: Pre Finance Scheme to Support the Closed Industry and Service Sectors | INVESTMENT FACILITY | Foreign Investment and Financing Portal | SAARCFINANCE | BBTA Journal: Thoughts on Banking and Finance","Executives | Treasury Bill/Bond auctions | Data Of Treasury Bills & Bonds | Credit Rating Of Banks | Primary Auction of Treasury Bill & Bond | Secondary Trading of Treasury Bills and Bonds | G-Sec Investment Process | BD Govt Investment Sukuk (BGIS) | Publication Weekly Fortnightly Monthly Quarterly Half Yearly Annual Research Work Special Publication Others | Draft Investment products: Bai-Murabaha - policy [Please send your feedback/coments/suggestions to masiur.rahman@bb.org.bd within 03 August, 2026] | BRPD-3 Circular Letter No. 01: Pre Finance Scheme to Support the Closed Industry and Service Sectors | INVESTMENT FACILITY | Foreign Investment and Financing Portal | SAARCFINANCE | BBTA Journal: Thoughts on Banking and Finance",https://www.bb.org.bd/en/index.php,200,
2026-07-14T02:54:22+06:00,Interbank FX Market,NBFI,JOB FOUND,"Executives | Treasury Bill/Bond auctions | Data Of Treasury Bills & Bonds | Credit Rating Of Banks | Primary Auction of Treasury Bill & Bond | Secondary Trading of Treasury Bills and Bonds | G-Sec Investment Process | BD Govt Investment Sukuk (BGIS) | Publication Weekly Fortnightly Monthly Quarterly Half Yearly Annual Research Work Special Publication Others | Draft Investment products: Bai-Murabaha - policy [Please send your feedback/coments/suggestions to masiur.rahman@bb.org.bd within 03 August, 2026] | BRPD-3 Circular Letter No. 01: Pre Finance Scheme to Support the Closed Industry and Service Sectors | INVESTMENT FACILITY | Foreign Investment and Financing Portal | SAARCFINANCE | BBTA Journal: Thoughts on Banking and Finance","Executives | Treasury Bill/Bond auctions | Data Of Treasury Bills & Bonds | Credit Rating Of Banks | Primary Auction of Treasury Bill & Bond | Secondary Trading of Treasury Bills and Bonds | G-Sec Investment Process | BD Govt Investment Sukuk (BGIS) | Publication Weekly Fortnightly Monthly Quarterly Half Yearly Annual Research Work Special Publication Others | Draft Investment products: Bai-Murabaha - policy [Please send your feedback/coments/suggestions to masiur.rahman@bb.org.bd within 03 August, 2026] | BRPD-3 Circular Letter No. 01: Pre Finance Scheme to Support the Closed Industry and Service Sectors | INVESTMENT FACILITY | Foreign Investment and Financing Portal | SAARCFINANCE | BBTA Journal: Thoughts on Banking and Finance",https://www.bb.org.bd/en/index.php,200,
2026-07-14T02:54:22+06:00,International Leasing and Financial Services Limited,NBFI,CHECK FAILED,,,http://www.ilfsl.com,404,HTTP 404
2026-07-14T02:54:22+06:00,Islamic Finance and Investment Limited,NBFI,JOB FOUND,Executive Committee | Risk Management Committee | Investment Products | Sustainable Finance | © Islamic Finance and Investment Limited,Executive Committee | Risk Management Committee | Investment Products | Sustainable Finance | © Islamic Finance and Investment Limited,http://www.ifilbd.com/careers,200,
2026-07-14T02:54:22+06:00,LankaBangla Finance PLC.,NBFI,BLOCKED,,,https://www.lankabangla.com,,Blocked by robots.txt: https://www.lankabangla.com/robots.txt
